{
  "schemaVersion": 1,
  "generatedBy": "bun run ui:performance:generate",
  "scope": {
    "mode": "official",
    "repositories": [
      "bakin",
      "bakin-bits-official"
    ],
    "compatibilityMatrix": "design-system/compatibility.json"
  },
  "css": {
    "canonicalPath": "packages/sdk/styles.css",
    "canonicalBytes": 192901,
    "copyCount": 1,
    "copyPaths": [
      "packages/sdk/styles.css"
    ]
  },
  "hostInitialJs": {
    "path": "packages/host/dist/main.js",
    "bytes": 184345
  },
  "sdkUiBundles": [
    {
      "name": "sdk-charts",
      "path": "packages/host/public/vendor/sdk-charts.js",
      "bytes": 39622,
      "reachableBytes": 71467
    },
    {
      "name": "sdk-content",
      "path": "packages/host/public/vendor/sdk-content.js",
      "bytes": 350443,
      "reachableBytes": 481192
    },
    {
      "name": "sdk-conversation",
      "path": "packages/host/public/vendor/sdk-conversation.js",
      "bytes": 53486,
      "reachableBytes": 332723
    },
    {
      "name": "sdk-layout",
      "path": "packages/host/public/vendor/sdk-layout.js",
      "bytes": 3448,
      "reachableBytes": 9895
    },
    {
      "name": "sdk-navigation",
      "path": "packages/host/public/vendor/sdk-navigation.js",
      "bytes": 2852,
      "reachableBytes": 121271
    },
    {
      "name": "sdk-patterns",
      "path": "packages/host/public/vendor/sdk-patterns.js",
      "bytes": 123755,
      "reachableBytes": 537208
    },
    {
      "name": "sdk-ui",
      "path": "packages/host/public/vendor/sdk-ui.js",
      "bytes": 84981,
      "reachableBytes": 490996
    }
  ],
  "vendorChunks": [
    {
      "path": "packages/host/public/vendor/jsx-dev-runtime.js",
      "bytes": 427
    },
    {
      "path": "packages/host/public/vendor/jsx-runtime.js",
      "bytes": 1067
    },
    {
      "path": "packages/host/public/vendor/react-dom.js",
      "bytes": 216411
    },
    {
      "path": "packages/host/public/vendor/react.js",
      "bytes": 10140
    },
    {
      "path": "packages/host/public/vendor/sdk-charts.js",
      "bytes": 39622
    },
    {
      "path": "packages/host/public/vendor/sdk-content.js",
      "bytes": 350443
    },
    {
      "path": "packages/host/public/vendor/sdk-conversation.js",
      "bytes": 53486
    },
    {
      "path": "packages/host/public/vendor/sdk-hooks.js",
      "bytes": 31660
    },
    {
      "path": "packages/host/public/vendor/sdk-index.js",
      "bytes": 1039
    },
    {
      "path": "packages/host/public/vendor/sdk-internal.js",
      "bytes": 1476
    },
    {
      "path": "packages/host/public/vendor/sdk-layout.js",
      "bytes": 3448
    },
    {
      "path": "packages/host/public/vendor/sdk-navigation.js",
      "bytes": 2852
    },
    {
      "path": "packages/host/public/vendor/sdk-patterns.js",
      "bytes": 123755
    },
    {
      "path": "packages/host/public/vendor/sdk-routing.js",
      "bytes": 192
    },
    {
      "path": "packages/host/public/vendor/sdk-shared-0bet9ed4.js",
      "bytes": 139488
    },
    {
      "path": "packages/host/public/vendor/sdk-shared-1bhrrs7q.js",
      "bytes": 338
    },
    {
      "path": "packages/host/public/vendor/sdk-shared-3pat975s.js",
      "bytes": 28381
    },
    {
      "path": "packages/host/public/vendor/sdk-shared-43191fa2.js",
      "bytes": 5145
    },
    {
      "path": "packages/host/public/vendor/sdk-shared-45f47xth.js",
      "bytes": 3464
    },
    {
      "path": "packages/host/public/vendor/sdk-shared-6rp8wqda.js",
      "bytes": 600
    },
    {
      "path": "packages/host/public/vendor/sdk-shared-a685z7xq.js",
      "bytes": 1723
    },
    {
      "path": "packages/host/public/vendor/sdk-shared-ajt1m019.js",
      "bytes": 583
    },
    {
      "path": "packages/host/public/vendor/sdk-shared-bpzwkj49.js",
      "bytes": 6166
    },
    {
      "path": "packages/host/public/vendor/sdk-shared-c91e9gff.js",
      "bytes": 807
    },
    {
      "path": "packages/host/public/vendor/sdk-shared-cefg3902.js",
      "bytes": 6980
    },
    {
      "path": "packages/host/public/vendor/sdk-shared-ckk2tgge.js",
      "bytes": 82246
    },
    {
      "path": "packages/host/public/vendor/sdk-shared-dn3rsgsx.js",
      "bytes": 2983
    },
    {
      "path": "packages/host/public/vendor/sdk-shared-e000kkvc.js",
      "bytes": 130520
    },
    {
      "path": "packages/host/public/vendor/sdk-shared-gqabj756.js",
      "bytes": 1142
    },
    {
      "path": "packages/host/public/vendor/sdk-shared-ky9pzgdz.js",
      "bytes": 512
    },
    {
      "path": "packages/host/public/vendor/sdk-shared-n78zz4b7.js",
      "bytes": 0
    },
    {
      "path": "packages/host/public/vendor/sdk-shared-p431g0gj.js",
      "bytes": 5530
    },
    {
      "path": "packages/host/public/vendor/sdk-shared-pbdak51x.js",
      "bytes": 11623
    },
    {
      "path": "packages/host/public/vendor/sdk-shared-q38wg1fw.js",
      "bytes": 1180
    },
    {
      "path": "packages/host/public/vendor/sdk-shared-s0j9c20q.js",
      "bytes": 2927
    },
    {
      "path": "packages/host/public/vendor/sdk-shared-s9hdzc7k.js",
      "bytes": 0
    },
    {
      "path": "packages/host/public/vendor/sdk-shared-sw145q7f.js",
      "bytes": 3536
    },
    {
      "path": "packages/host/public/vendor/sdk-shared-vh7pp6yg.js",
      "bytes": 999
    },
    {
      "path": "packages/host/public/vendor/sdk-shared-wh2cjaea.js",
      "bytes": 6555
    },
    {
      "path": "packages/host/public/vendor/sdk-shared-wn874wv5.js",
      "bytes": 524
    },
    {
      "path": "packages/host/public/vendor/sdk-shared-yptd4gzn.js",
      "bytes": 391
    },
    {
      "path": "packages/host/public/vendor/sdk-shared-yz07gt64.js",
      "bytes": 1302
    },
    {
      "path": "packages/host/public/vendor/sdk-shared-zq4yacmh.js",
      "bytes": 7934
    },
    {
      "path": "packages/host/public/vendor/sdk-shared-zrr8j7vj.js",
      "bytes": 1871
    },
    {
      "path": "packages/host/public/vendor/sdk-slots.js",
      "bytes": 2149
    },
    {
      "path": "packages/host/public/vendor/sdk-types.js",
      "bytes": 765
    },
    {
      "path": "packages/host/public/vendor/sdk-ui.js",
      "bytes": 84981
    },
    {
      "path": "packages/host/public/vendor/sdk-utils.js",
      "bytes": 8627
    },
    {
      "path": "packages/host/public/vendor/tanstack-router.js",
      "bytes": 97731
    },
    {
      "path": "packages/host/public/vendor/zod.js",
      "bytes": 394939
    }
  ],
  "pluginClients": [
    {
      "repository": "bakin-bits-official",
      "pluginId": "_template",
      "path": "bakin-bits-official/plugins/_template/dist/client.js",
      "bytes": 11092
    },
    {
      "repository": "bakin-bits-official",
      "pluginId": "messaging",
      "path": "bakin-bits-official/plugins/messaging/dist/client.js",
      "bytes": 257990
    },
    {
      "repository": "bakin-bits-official",
      "pluginId": "projects",
      "path": "bakin-bits-official/plugins/projects/dist/client.js",
      "bytes": 145853
    },
    {
      "repository": "bakin-bits-official",
      "pluginId": "terminal",
      "path": "bakin-bits-official/plugins/terminal/dist/client.js",
      "bytes": 692027
    },
    {
      "repository": "bakin",
      "pluginId": "assets",
      "path": "plugins/assets/dist/client.js",
      "bytes": 84794
    },
    {
      "repository": "bakin",
      "pluginId": "brands",
      "path": "plugins/brands/dist/client.js",
      "bytes": 101632
    },
    {
      "repository": "bakin",
      "pluginId": "chat",
      "path": "plugins/chat/dist/client.js",
      "bytes": 35208
    },
    {
      "repository": "bakin",
      "pluginId": "explore",
      "path": "plugins/explore/dist/client.js",
      "bytes": 48158
    },
    {
      "repository": "bakin",
      "pluginId": "health",
      "path": "plugins/health/dist/client.js",
      "bytes": 266654
    },
    {
      "repository": "bakin",
      "pluginId": "memory",
      "path": "plugins/memory/dist/client.js",
      "bytes": 35972
    },
    {
      "repository": "bakin",
      "pluginId": "models",
      "path": "plugins/models/dist/client.js",
      "bytes": 72594
    },
    {
      "repository": "bakin",
      "pluginId": "schedule",
      "path": "plugins/schedule/dist/client.js",
      "bytes": 57467
    },
    {
      "repository": "bakin",
      "pluginId": "spend",
      "path": "plugins/spend/dist/client.js",
      "bytes": 64060
    },
    {
      "repository": "bakin",
      "pluginId": "tasks",
      "path": "plugins/tasks/dist/client.js",
      "bytes": 214457
    },
    {
      "repository": "bakin",
      "pluginId": "team",
      "path": "plugins/team/dist/client.js",
      "bytes": 305726
    },
    {
      "repository": "bakin",
      "pluginId": "workflows",
      "path": "plugins/workflows/dist/client.js",
      "bytes": 368539
    }
  ]
}
