{
  "schemaVersion": 1,
  "generatedBy": "bun run ui:performance:generate",
  "scope": {
    "mode": "official",
    "repositories": [
      "bakin",
      "bakin-bits-official"
    ],
    "compatibilityMatrix": "design-system/compatibility.json"
  },
  "css": {
    "canonicalPath": "packages/sdk/styles.css",
    "canonicalBytes": 191349,
    "copyCount": 1,
    "copyPaths": [
      "packages/sdk/styles.css"
    ]
  },
  "hostInitialJs": {
    "path": "packages/host/dist/main.js",
    "bytes": 234731
  },
  "sdkUiBundles": [
    {
      "name": "sdk-charts",
      "path": "packages/host/public/vendor/sdk-charts.js",
      "bytes": 39139,
      "reachableBytes": 70500
    },
    {
      "name": "sdk-content",
      "path": "packages/host/public/vendor/sdk-content.js",
      "bytes": 350469,
      "reachableBytes": 845893
    },
    {
      "name": "sdk-conversation",
      "path": "packages/host/public/vendor/sdk-conversation.js",
      "bytes": 56292,
      "reachableBytes": 710486
    },
    {
      "name": "sdk-layout",
      "path": "packages/host/public/vendor/sdk-layout.js",
      "bytes": 4318,
      "reachableBytes": 10670
    },
    {
      "name": "sdk-navigation",
      "path": "packages/host/public/vendor/sdk-navigation.js",
      "bytes": 596,
      "reachableBytes": 425394
    },
    {
      "name": "sdk-patterns",
      "path": "packages/host/public/vendor/sdk-patterns.js",
      "bytes": 2395,
      "reachableBytes": 617671
    },
    {
      "name": "sdk-ui",
      "path": "packages/host/public/vendor/sdk-ui.js",
      "bytes": 8728,
      "reachableBytes": 501798
    }
  ],
  "vendorChunks": [
    {
      "path": "packages/host/public/vendor/jsx-dev-runtime.js",
      "bytes": 427
    },
    {
      "path": "packages/host/public/vendor/jsx-runtime.js",
      "bytes": 989
    },
    {
      "path": "packages/host/public/vendor/react-dom.js",
      "bytes": 185227
    },
    {
      "path": "packages/host/public/vendor/react.js",
      "bytes": 9708
    },
    {
      "path": "packages/host/public/vendor/sdk-charts.js",
      "bytes": 39139
    },
    {
      "path": "packages/host/public/vendor/sdk-content.js",
      "bytes": 350469
    },
    {
      "path": "packages/host/public/vendor/sdk-conversation.js",
      "bytes": 56292
    },
    {
      "path": "packages/host/public/vendor/sdk-hooks.js",
      "bytes": 1530
    },
    {
      "path": "packages/host/public/vendor/sdk-index.js",
      "bytes": 382
    },
    {
      "path": "packages/host/public/vendor/sdk-internal.js",
      "bytes": 1451
    },
    {
      "path": "packages/host/public/vendor/sdk-layout.js",
      "bytes": 4318
    },
    {
      "path": "packages/host/public/vendor/sdk-metadata.js",
      "bytes": 362
    },
    {
      "path": "packages/host/public/vendor/sdk-navigation.js",
      "bytes": 596
    },
    {
      "path": "packages/host/public/vendor/sdk-patterns.js",
      "bytes": 2395
    },
    {
      "path": "packages/host/public/vendor/sdk-routing.js",
      "bytes": 157
    },
    {
      "path": "packages/host/public/vendor/sdk-shared-3jytqzgz.js",
      "bytes": 1264
    },
    {
      "path": "packages/host/public/vendor/sdk-shared-4ffw72f1.js",
      "bytes": 82587
    },
    {
      "path": "packages/host/public/vendor/sdk-shared-4y9pxwcp.js",
      "bytes": 3333
    },
    {
      "path": "packages/host/public/vendor/sdk-shared-5a99ptnx.js",
      "bytes": 1814
    },
    {
      "path": "packages/host/public/vendor/sdk-shared-9dn0qn42.js",
      "bytes": 1804
    },
    {
      "path": "packages/host/public/vendor/sdk-shared-bmsw4wcn.js",
      "bytes": 199
    },
    {
      "path": "packages/host/public/vendor/sdk-shared-ccs9nnma.js",
      "bytes": 32164
    },
    {
      "path": "packages/host/public/vendor/sdk-shared-e5f6tmvs.js",
      "bytes": 711
    },
    {
      "path": "packages/host/public/vendor/sdk-shared-edep81ba.js",
      "bytes": 1938
    },
    {
      "path": "packages/host/public/vendor/sdk-shared-edkvzga3.js",
      "bytes": 27174
    },
    {
      "path": "packages/host/public/vendor/sdk-shared-fz67qhy7.js",
      "bytes": 28546
    },
    {
      "path": "packages/host/public/vendor/sdk-shared-gg2fx0xq.js",
      "bytes": 5235
    },
    {
      "path": "packages/host/public/vendor/sdk-shared-grq7njak.js",
      "bytes": 3476
    },
    {
      "path": "packages/host/public/vendor/sdk-shared-j8abm5y4.js",
      "bytes": 161647
    },
    {
      "path": "packages/host/public/vendor/sdk-shared-mp8adrx5.js",
      "bytes": 2165
    },
    {
      "path": "packages/host/public/vendor/sdk-shared-wmz95h43.js",
      "bytes": 302274
    },
    {
      "path": "packages/host/public/vendor/sdk-shared-z2fqt0gv.js",
      "bytes": 280602
    },
    {
      "path": "packages/host/public/vendor/sdk-slots.js",
      "bytes": 2275
    },
    {
      "path": "packages/host/public/vendor/sdk-types.js",
      "bytes": 116
    },
    {
      "path": "packages/host/public/vendor/sdk-ui.js",
      "bytes": 8728
    },
    {
      "path": "packages/host/public/vendor/sdk-utils.js",
      "bytes": 8008
    },
    {
      "path": "packages/host/public/vendor/tanstack-router.js",
      "bytes": 118784
    }
  ],
  "pluginClients": [
    {
      "repository": "bakin-bits-official",
      "pluginId": "_template",
      "path": "bakin-bits-official/plugins/_template/dist/client.js",
      "bytes": 11092
    },
    {
      "repository": "bakin-bits-official",
      "pluginId": "messaging",
      "path": "bakin-bits-official/plugins/messaging/dist/client.js",
      "bytes": 713362
    },
    {
      "repository": "bakin-bits-official",
      "pluginId": "projects",
      "path": "bakin-bits-official/plugins/projects/dist/client.js",
      "bytes": 139378
    },
    {
      "repository": "bakin-bits-official",
      "pluginId": "terminal",
      "path": "bakin-bits-official/plugins/terminal/dist/client.js",
      "bytes": 514331
    },
    {
      "repository": "bakin",
      "pluginId": "assets",
      "path": "plugins/assets/dist/client.js",
      "bytes": 70945
    },
    {
      "repository": "bakin",
      "pluginId": "brands",
      "path": "plugins/brands/dist/client.js",
      "bytes": 90496
    },
    {
      "repository": "bakin",
      "pluginId": "chat",
      "path": "plugins/chat/dist/client.js",
      "bytes": 32934
    },
    {
      "repository": "bakin",
      "pluginId": "explore",
      "path": "plugins/explore/dist/client.js",
      "bytes": 41975
    },
    {
      "repository": "bakin",
      "pluginId": "health",
      "path": "plugins/health/dist/client.js",
      "bytes": 502722
    },
    {
      "repository": "bakin",
      "pluginId": "memory",
      "path": "plugins/memory/dist/client.js",
      "bytes": 33064
    },
    {
      "repository": "bakin",
      "pluginId": "models",
      "path": "plugins/models/dist/client.js",
      "bytes": 81018
    },
    {
      "repository": "bakin",
      "pluginId": "schedule",
      "path": "plugins/schedule/dist/client.js",
      "bytes": 54012
    },
    {
      "repository": "bakin",
      "pluginId": "tasks",
      "path": "plugins/tasks/dist/client.js",
      "bytes": 201153
    },
    {
      "repository": "bakin",
      "pluginId": "team",
      "path": "plugins/team/dist/client.js",
      "bytes": 278124
    },
    {
      "repository": "bakin",
      "pluginId": "workflows",
      "path": "plugins/workflows/dist/client.js",
      "bytes": 615249
    }
  ]
}